{
  "id": "base:acacia",
  "log": "base:log",
  "leaves": "base:leaves",
  "biomes": [
    "base:plains",
    "base:desert"
  ],
  "climate": {
    "temperature": [
      0.6,
      1
    ],
    "moisture": [
      0,
      0.55
    ]
  },
  "spacing": {
    "min_radius": 6
  },
  "density": 0.6,
  "shape": {
    "type": "acacia"
  }
}
